{
  "$id": "urn:ratatoskr:contracts:events:v1:FileChanged",
  "$schema": "https://json-schema.org/draft/2020-12/schema",
  "title": "FileChanged",
  "description": "Payload of `notes.file.changed.v1`: one file of a connected vault was created, updated,\nrenamed or deleted.\n\nA fact. The enclosing envelope carries the owner as `tenant_id` (`user:<id>`) and the\naggregate `notes_file:<file_id>`; the payload does not repeat the owner. It carries a\n[`BlobRef`] for the bytes, never the bytes or any part of the file text, and it refuses every\nmember it does not declare.\n\n`Deserialize` is hand-written because the rules are cross-field: `previous_path` is present\nexactly when the kind is `renamed`, `blob` is present exactly when the kind is not `deleted`,\nthe blob digest equals `revision` and the blob belongs to `ratatoskr-notes`, and\n`connection_sequence` is at least 1. It parses a private mirror struct and then calls\n[`FileChanged::validate`].",
  "type": "object",
  "properties": {
    "blob": {
      "description": "The stored bytes of this revision, owned by `ratatoskr-notes`; its SHA-256 digest equals\n`revision` and its media type equals `media_type`. Present exactly when `change_kind` is\nnot `deleted`.",
      "anyOf": [
        {
          "$ref": "#/$defs/BlobRef"
        },
        {
          "type": "null"
        }
      ]
    },
    "change_kind": {
      "description": "What happened to the file.",
      "$ref": "#/$defs/FileChangeKind"
    },
    "connection_id": {
      "description": "The connection the file belongs to.",
      "$ref": "#/$defs/NotesConnectionId"
    },
    "connection_sequence": {
      "description": "The position of this event among the published events of its connection. Starts at 1 for\neach connection and grows by exactly one per published event, so a consumer can detect a\nmissing event.",
      "type": "integer",
      "format": "uint64",
      "minimum": 1
    },
    "file_id": {
      "description": "The file, stable across updates and renames.",
      "$ref": "#/$defs/NotesFileId"
    },
    "media_type": {
      "description": "The media type of the file bytes.",
      "$ref": "#/$defs/MediaType"
    },
    "path": {
      "description": "The path of the file after the change, relative to the vault root, in NFC. For `deleted`,\nthe path the file had when it left the vault.",
      "$ref": "#/$defs/VaultPath"
    },
    "previous_path": {
      "description": "The path before the change. Present exactly when `change_kind` is `renamed`.",
      "anyOf": [
        {
          "$ref": "#/$defs/VaultPath"
        },
        {
          "type": "null"
        }
      ]
    },
    "revision": {
      "description": "The lowercase hex SHA-256 of the file bytes. For `deleted`, the revision the file had when\nit left the vault.",
      "$ref": "#/$defs/DigestHex"
    }
  },
  "additionalProperties": false,
  "required": [
    "change_kind",
    "connection_id",
    "connection_sequence",
    "file_id",
    "media_type",
    "path",
    "revision"
  ],
  "x-ratatoskr-provenance": {
    "canonical_source": "ratatoskr_notes_contracts::FileChanged",
    "contract_id": "notes.file_changed",
    "contract_major_version": 1,
    "generated": "DO NOT EDIT — generated by contractsc from the canonical Rust source. Change the Rust type and run `cargo contracts generate`.",
    "generator": "contractsc",
    "generator_version": "0.1.0",
    "schemars_version": "1.2.2",
    "source_digest": "sha256:08ec7c1cb5487bb0f4ea43873d29650fc6aa3f746e63146d41bade9ede830deb",
    "validation_note": "This schema is a LOWER BOUND on validity. Cross-field invariants and canonical-form rules are enforced by the canonical Rust type; see fixtures/invalid-expectations.toml for which layer rejects what."
  },
  "$defs": {
    "BlobOwner": {
      "title": "BlobOwner",
      "description": "Deployment identity of the service that owns and resolves a blob.",
      "type": "string",
      "examples": [
        "ratatoskr-extractor",
        "ratatoskr-vault"
      ],
      "maxLength": 64,
      "pattern": "^[a-z][a-z0-9-]{1,63}$"
    },
    "BlobRef": {
      "description": "Reference to content-addressed bytes owned by one service.\n\nThis is a reference, not a storage API. The owner writes and resolves the bytes under its own\ncontent-addressed directory. No host, filesystem path, signed URL, credentials, or expiry can\nappear in this contract.",
      "type": "object",
      "properties": {
        "digest": {
          "description": "Digest that names the bytes and lets a reader verify them.",
          "$ref": "#/$defs/ContentDigest"
        },
        "length_bytes": {
          "description": "Exact byte length of the stored value.",
          "type": "integer",
          "format": "uint64",
          "minimum": 0
        },
        "media_type": {
          "description": "Media type of the stored bytes.",
          "$ref": "#/$defs/MediaType"
        },
        "owner_service": {
          "description": "Service that owns the bytes and their lifecycle.",
          "$ref": "#/$defs/BlobOwner"
        }
      },
      "additionalProperties": false,
      "required": [
        "digest",
        "length_bytes",
        "media_type",
        "owner_service"
      ]
    },
    "ContentDigest": {
      "description": "A content digest with an explicit algorithm.",
      "type": "object",
      "properties": {
        "algorithm": {
          "description": "Hash algorithm used to produce `hex`.",
          "$ref": "#/$defs/DigestAlgorithm"
        },
        "hex": {
          "description": "Lowercase hexadecimal digest bytes.",
          "$ref": "#/$defs/DigestHex"
        }
      },
      "additionalProperties": false,
      "required": [
        "algorithm",
        "hex"
      ]
    },
    "DigestAlgorithm": {
      "description": "Algorithm used to calculate a content digest.",
      "oneOf": [
        {
          "description": "SHA-256.",
          "type": "string",
          "const": "sha256"
        }
      ]
    },
    "DigestHex": {
      "title": "DigestHex",
      "description": "Lowercase hexadecimal bytes of a content digest.",
      "type": "string",
      "examples": [
        "0000000000000000000000000000000000000000000000000000000000000000"
      ],
      "maxLength": 64,
      "pattern": "^[0-9a-f]{64}$"
    },
    "FileChangeKind": {
      "description": "What happened to the file.\n\n**Closed on purpose**: a consumer branches on the kind to index, move or forget a file, and an\nunknown kind must stop processing instead of being read as one of them.",
      "oneOf": [
        {
          "description": "The file appeared in the vault.",
          "type": "string",
          "const": "created"
        },
        {
          "description": "The bytes of the file changed under the same path.",
          "type": "string",
          "const": "updated"
        },
        {
          "description": "The file moved from `previous_path` to `path`.",
          "type": "string",
          "const": "renamed"
        },
        {
          "description": "The file left the vault, or became excluded.",
          "type": "string",
          "const": "deleted"
        }
      ]
    },
    "MediaType": {
      "title": "MediaType",
      "description": "Internet media type of stored bytes, without parameters.",
      "type": "string",
      "examples": [
        "text/html",
        "application/pdf"
      ],
      "maxLength": 255,
      "pattern": "^[a-z0-9][a-z0-9!#$&^_.+-]{0,126}/[a-z0-9][a-z0-9!#$&^_.+-]{0,126}$"
    },
    "NotesConnectionId": {
      "title": "NotesConnectionId",
      "description": "Identity of one vault connection of ratatoskr-notes. Bare canonical lowercase hyphenated UUID; not namespaced.",
      "type": "string",
      "format": "uuid",
      "examples": [
        "018f0000-0000-7000-8000-000000000001"
      ],
      "pattern": "^[0-9a-f]{8}-[0-9a-f]{4}-[0-9a-f]{4}-[0-9a-f]{4}-[0-9a-f]{12}$"
    },
    "NotesFileId": {
      "title": "NotesFileId",
      "description": "Identity of one file of a connected vault, stable across renames. Bare canonical lowercase hyphenated UUID; not namespaced.",
      "type": "string",
      "format": "uuid",
      "examples": [
        "018f0000-0000-7000-8000-000000000001"
      ],
      "pattern": "^[0-9a-f]{8}-[0-9a-f]{4}-[0-9a-f]{4}-[0-9a-f]{4}-[0-9a-f]{12}$"
    },
    "VaultPath": {
      "title": "VaultPath",
      "description": "A file path relative to the vault root, segments separated by `/`.\n\nNot empty, at most 1024 UTF-8 bytes, no leading or trailing `/`, no empty, `.` or `..`\nsegment, no backslash and no C0 or DEL control character, so a path can never name a file\noutside the vault.\n\nThe path is in Unicode NFC. This contract does not check NFC: the producer normalises\nevery path before it publishes one, and a consumer may rely on it.",
      "type": "string",
      "examples": [
        "Projects/Plan.md",
        "Daily/2026-10-13.md"
      ],
      "maxLength": 1024,
      "pattern": "^(?:[^./\\\\\\x00-\\x1f\\x7f]|\\.[^./\\\\\\x00-\\x1f\\x7f]|\\.\\.[^/\\\\\\x00-\\x1f\\x7f])[^/\\\\\\x00-\\x1f\\x7f]*(?:/(?:[^./\\\\\\x00-\\x1f\\x7f]|\\.[^./\\\\\\x00-\\x1f\\x7f]|\\.\\.[^/\\\\\\x00-\\x1f\\x7f])[^/\\\\\\x00-\\x1f\\x7f]*)*$"
    }
  }
}
