{
  "connection_id": "018f0000-0000-7000-8000-000000000b01",
  "file_id": "018f0000-0000-7000-8000-000000000b11",
  "connection_sequence": 1,
  "change_kind": "created",
  "path": "Projects/Plan.md",
  "revision": "0a1b2c3d4e5f60710a1b2c3d4e5f60710a1b2c3d4e5f60710a1b2c3d4e5f6071",
  "media_type": "text/markdown",
  "blob": {
    "owner_service": "ratatoskr-notes",
    "digest": {
      "algorithm": "sha256",
      "hex": "0a1b2c3d4e5f60710a1b2c3d4e5f60710a1b2c3d4e5f60710a1b2c3d4e5f6071"
    },
    "media_type": "text/markdown",
    "length_bytes": 2048
  }
}
