{
  "connection_id": "018f0000-0000-7000-8000-000000000b01",
  "file_id": "018f0000-0000-7000-8000-000000000b11",
  "connection_sequence": 4,
  "change_kind": "deleted",
  "path": "Archive/Café Plan.md",
  "revision": "1f2e3d4c5b6a70811f2e3d4c5b6a70811f2e3d4c5b6a70811f2e3d4c5b6a7081",
  "media_type": "text/markdown"
}
